Number,DEB Stylized Fact,Accuracy,I have an explanation,Importance
101,"Metabolic rate increases with body mass, but not proportionally – it follows an allometric relationship (typically scales as $\propto$ mass$^{3/4}$).",,,
102,There is a relationship between body mass and lifespan: larger animals grow slower and live longer.,,,
103,"Food intake capacity is limited by body surface area, while maintenance needs are proportional to volume.",,,
104,Time to puberty and total lifespan increase with body mass – so-called life-history invariants.,,,
105,Maximum assimilation rate scales with body mass to a power less than 1.,,,
106,"Maintenance rate per unit structure is constant within species, but varies between species.",,,
107,Reproductive output scales with body mass through the same power as basal metabolism.,,,
108,Assimilation efficiency decreases with size due to geometric constraints.,,,
109,Surface area-to-volume ratio determines metabolic constraints for material transport and heat.,,,
110,Allometric exponent for heart rate is negative ($\sim$-0.25).,,,
111,Breathing rate scales negatively with body mass across species.,,,
112,Blood circulation time increases with body size due to longer transport distances.,,,
113,Metabolic scope (difference between maximum and resting metabolic rate) scales with body mass.,,,
114,Digestive tract length scales with body mass and dietary requirements.,,,
115,"Brain mass scales differently from body mass, typically with a lower allometric exponent.",,,
116,Kidney filtration rate scales with metabolic rate and body mass.,,,
117,Bone strength scales with body mass to ensure structural integrity.,,,
118,Muscle mass proportion decreases with increasing body size in most taxa.,,,
119,Heat production rate scales with metabolic rate and affects thermoregulatory strategies.,,,
120,Oxygen consumption rate per unit mass decreases with increasing body size.,,,
121,Swimming speed in aquatic animals scales positively with body length.,,,
122,Flight metabolic rate in birds scales differently from terrestrial locomotion costs.,,,
123,Dive duration in aquatic mammals scales with body mass and oxygen storage capacity.,,,
124,Territory size scales with body mass and energy requirements in many species.,,,
125,Foraging range increases with body size to meet elevated energy demands.,,,
126,Daily energy expenditure scales with body mass but varies with activity patterns.,,,
127,Seasonal fat storage capacity scales with body mass and climate adaptations.,,,
128,Hibernation metabolic depression is more pronounced in smaller mammals.,,,
129,Migration distance correlates with body size and energy storage capabilities.,,,
130,Immune system investment scales with body mass and pathogen exposure risk.,,,
131,Wound healing rate decreases with body size due to circulatory constraints.,,,
132,Sensory organ size scales differently from body mass depending on function.,,,
133,Reproductive organ size scales with body mass and mating system characteristics.,,,
134,Gestation time increases with body mass and offspring development requirements.,,,
135,Litter size typically decreases with increasing maternal body mass.,,,
136,Parental care duration scales with offspring development time and body size.,,,
137,Age at first reproduction increases with adult body size across taxa.,,,
138,Maximum population density decreases with average individual body mass.,,,
139,Home range size scales with body mass and resource distribution patterns.,,,
140,Dispersal distance correlates with body size and habitat fragmentation.,,,
141,Predator-prey mass ratios follow predictable scaling relationships.,,,
142,Trophic level position correlates with body size in food webs.,,,
143,Biomass turnover rate decreases with increasing organism size.,,,
144,Population growth rate scales negatively with body mass.,,,
145,Extinction risk correlates with body size through population size effects.,,,
146,Metabolic cold adaptation involves changes in allometric relationships.,,,
147,Altitude adaptation affects metabolic scaling due to oxygen availability.,,,
148,Aquatic vs terrestrial environments impose different scaling constraints.,,,
149,Developmental temperature affects adult allometric relationships.,,,
150,Sexual dimorphism in body size affects metabolic scaling within species.,,,
151,Seasonal changes in body mass alter temporary allometric relationships.,,,
152,Aging affects metabolic scaling through changes in body composition.,,,
153,Diet quality influences the scaling of digestive system components.,,,
154,Social organization affects metabolic scaling through cooperative behaviors.,,,
155,Parasitism alters host metabolic scaling relationships.,,,
156,Symbiotic relationships modify allometric patterns in partner organisms.,,,
157,Habitat complexity influences locomotor scaling relationships.,,,
158,Predation pressure affects the evolution of size-related traits and scaling.,,,
159,Competition intensity scales with body size overlap between species.,,,
160,Resource availability influences optimal body size and scaling patterns.,,,
161,Climate variability affects size-related adaptations and allometric relationships.,,,
162,Island environments often lead to altered scaling relationships.,,,
163,Urbanization impacts metabolic scaling through environmental changes.,,,
164,Pollution exposure affects size-dependent physiological processes.,,,
165,Conservation status correlates with body size through multiple mechanisms.,,,
166,Phylogenetic constraints influence the evolution of allometric relationships.,,,
167,Developmental plasticity allows modification of scaling relationships.,,,
168,Life history strategies reflect different solutions to scaling constraints.,,,
169,Biomechanical limits impose constraints on size-related performance scaling.,,,
170,Physiological limits determine maximum achievable body sizes in different taxa.,,,
171,Cellular size constraints influence tissue-level scaling relationships.,,,
172,Molecular processes scale differently from organ-level functions.,,,
173,Network topology affects scaling of circulatory and nervous systems.,,,
174,Scaling relationships differ between growth phases and adult maintenance.,,,
175,Environmental stress modifies normal allometric relationships.,,,
176,Reproductive cycles influence temporary deviations from scaling laws.,,,
177,Behavioral adaptations can compensate for scaling-imposed constraints.,,,
178,Technological analogies help understand biological scaling principles.,,,
179,Mathematical models predict scaling relationships from first principles.,,,
180,Fractal geometry explains some aspects of biological scaling patterns.,,,
181,Optimization theory provides frameworks for understanding scaling evolution.,,,
182,Scaling relationships have predictive power for ecological and evolutionary processes.,,,
183,Cross-species comparisons reveal universal scaling principles.,,,
184,Intraspecific scaling may differ from interspecific patterns.,,,
185,Ontogenetic scaling changes throughout individual development.,,,
186,Scaling violations often indicate underlying physiological constraints or adaptations.,,,
187,Metabolic scaling forms the foundation for understanding ecological energetics.,,,
188,Size-dependent mortality patterns influence population dynamics and evolution.,,,
189,Scaling relationships provide tools for comparative physiology and ecology.,,,
190,Body size evolution reflects optimization under multiple scaling constraints.,,,
191,Scaling laws connect individual physiology to ecosystem-level processes.,,,
192,Allometric relationships facilitate predictions about unstudied species.,,,
193,Scaling analysis reveals the importance of size in biological organization.,,,
194,Size-based approaches provide frameworks for conservation biology applications.,,,
195,Metabolic scaling influences species interactions and community structure.,,,
196,Body size distributions reflect ecological and evolutionary processes.,,,
197,Scaling relationships help predict responses to environmental change.,,,
198,Size-dependent processes link ecology and evolution across biological scales.,,,
199,Allometric analysis provides insights into functional design principles.,,,
200,Scaling laws represent fundamental constraints on biological organization and function.,,,
