Number,DEB Stylized Fact,Accuracy,I have an explanation,Importance
701,Reserves are stored in specific organelles like lipid droplets and glycogen granules.,,,
702,"Structure includes cytoskeleton, membranes, and proteins that enable cellular functions.",,,
703,Maturation energy is linked to epigenetic changes during development.,,,
704,Catalytic properties of enzymes determine maximum rates of metabolic processes.,,,
705,Mitochondrial function is crucial for energy metabolism and DEB dynamics.,,,
706,Membrane permeability affects metabolite transport and energetic properties.,,,
707,Protein turnover contributes to maintenance costs and structural renewal.,,,
708,Oxidative stress is linked to maintenance costs and aging processes.,,,
709,Hormonal regulation coordinates DEB processes through signaling cascades.,,,
710,Gene expression reflects current metabolic state and energy priorities.,,,
711,ATP synthesis efficiency determines energy conversion rates in cellular metabolism.,,,
712,Enzyme kinetics parameters directly influence DEB metabolic rate constants.,,,
713,Membrane composition affects energy costs of cellular transport processes.,,,
714,DNA repair mechanisms consume energy and contribute to maintenance costs.,,,
715,Ribosome assembly and function require significant energy investment for protein synthesis.,,,
716,Cellular quality control systems consume energy to maintain structural integrity.,,,
717,Ion pump activity represents major component of cellular maintenance energy costs.,,,
718,Autophagy processes recycle cellular components and affect energy allocation efficiency.,,,
719,Chaperone proteins require energy to maintain proper protein folding and function.,,,
720,Calcium signaling mechanisms consume energy and coordinate metabolic responses.,,,
721,Cytoskeletal dynamics require energy for cellular structure maintenance and reorganization.,,,
722,Nuclear organization affects gene expression and energy allocation patterns.,,,
723,Endoplasmic reticulum function influences protein synthesis and energy utilization.,,,
724,Golgi apparatus processing consumes energy for cellular secretion and membrane trafficking.,,,
725,Lysosomal degradation processes contribute to energy recycling and cellular maintenance.,,,
726,Peroxisome function affects lipid metabolism and energy allocation patterns.,,,
727,Cytoplasmic streaming requires energy and affects intracellular transport efficiency.,,,
728,Cell division costs represent significant energy investment for structural growth.,,,
729,Apoptosis mechanisms consume energy but prevent maintenance costs of damaged cells.,,,
730,Stem cell maintenance requires specialized energy allocation for self-renewal.,,,
731,Differentiation processes involve energy-costly reorganization of cellular structure.,,,
732,Cell-cell communication requires energy for signal production and reception.,,,
733,Extracellular matrix production consumes significant energy for structural development.,,,
734,Tissue organization requires energy for coordinated cellular arrangement.,,,
735,Organ function emerges from cellular energy allocation patterns.,,,
736,Metabolic compartmentalization optimizes energy utilization within cells.,,,
737,Metabolon formation creates efficient energy conversion complexes.,,,
738,Allosteric regulation coordinates metabolic pathways with energy demands.,,,
739,Feedback inhibition prevents wasteful energy expenditure in metabolic pathways.,,,
740,Metabolic switches redirect energy flow based on cellular conditions.,,,
741,Energy charge ratios regulate metabolic activity and energy allocation.,,,
742,Redox state affects metabolic pathway activity and energy utilization.,,,
743,pH homeostasis requires energy and affects metabolic enzyme activity.,,,
744,Osmotic regulation consumes energy for cellular volume and pressure control.,,,
745,Heat shock responses require energy to maintain cellular function under stress.,,,
746,Cold adaptation involves metabolic adjustments affecting energy allocation efficiency.,,,
747,Circadian rhythms coordinate cellular energy allocation with environmental cycles.,,,
748,Cell cycle checkpoints ensure proper energy allocation before division.,,,
749,Growth factor signaling regulates cellular energy allocation between maintenance and growth.,,,
750,Stress response pathways redirect energy allocation for cellular protection.,,,
751,Metabolic reprogramming occurs during cellular differentiation and development.,,,
752,Cancer cells exhibit altered energy allocation patterns optimized for rapid proliferation.,,,
753,Aging involves progressive decline in cellular energy allocation efficiency.,,,
754,Cellular senescence represents energy allocation strategy under irreparable damage.,,,
755,Pluripotency maintenance requires specific energy allocation patterns in stem cells.,,,
756,Neuronal function requires specialized energy allocation for electrical activity.,,,
757,Muscle contraction represents dramatic temporary increase in energy allocation.,,,
758,Immune cell activation involves rapid shifts in energy allocation patterns.,,,
759,Hepatocyte function requires high energy allocation for metabolic processing.,,,
760,Adipocyte energy storage and release affects whole-organism energy allocation.,,,
761,Endocrine cell secretion requires energy for hormone production and release.,,,
762,Reproductive cell development involves specialized energy allocation for gamete production.,,,
763,Photosynthetic machinery requires energy investment for light harvesting apparatus.,,,
764,Chloroplast function determines energy input capacity in photosynthetic organisms.,,,
765,Carbon fixation pathways affect energy allocation efficiency in primary producers.,,,
766,Nitrogen fixation requires substantial energy investment in specialized bacteria.,,,
767,Chemosynthesis provides alternative energy input pathway in specialized environments.,,,
768,Fermentation represents low-efficiency energy allocation strategy under anaerobic conditions.,,,
769,Respiratory chain efficiency determines cellular energy conversion capacity.,,,
770,Glycolysis regulation affects rapid energy allocation for immediate cellular needs.,,,
771,Citric acid cycle function coordinates energy allocation with biosynthetic demands.,,,
772,Fatty acid oxidation provides sustained energy for long-term cellular maintenance.,,,
773,Amino acid catabolism contributes to energy allocation during protein turnover.,,,
774,Nucleotide metabolism affects energy allocation for DNA and RNA synthesis.,,,
775,Vitamin cofactor availability limits metabolic pathway efficiency and energy allocation.,,,
776,Mineral requirements affect enzyme function and energy allocation capacity.,,,
777,Trace element deficiencies can limit cellular energy allocation efficiency.,,,
778,Antioxidant systems require energy investment to protect cellular structures.,,,
779,Membrane potential maintenance consumes significant cellular energy resources.,,,
780,Active transport processes represent major component of cellular energy allocation.,,,
781,Passive transport efficiency affects overall cellular energy allocation patterns.,,,
782,Vesicular transport requires energy for intracellular material movement.,,,
783,Endocytosis and exocytosis processes consume energy for cellular material exchange.,,,
784,"Protein secretion requires energy for synthesis, modification, and transport.",,,
785,Cellular adhesion requires energy for junction formation and maintenance.,,,
786,Cell migration consumes significant energy for motility and directional movement.,,,
787,Cilia and flagella function require energy for cellular movement and fluid transport.,,,
788,Contractile apparatus requires energy for cellular shape changes and force generation.,,,
789,Cellular mechanosensing requires energy for detecting and responding to physical forces.,,,
790,Cellular electrical activity requires energy for ion gradient maintenance and signal propagation.,,,
791,Photoreception requires energy for light detection and signal transduction.,,,
792,Chemoreception requires energy for molecular detection and signal processing.,,,
793,Mechanoreception requires energy for mechanical force detection and transduction.,,,
794,Thermoreception requires energy for temperature detection and response.,,,
795,Cellular computation requires energy for information processing and decision making.,,,
796,Cellular memory requires energy for information storage and retrieval mechanisms.,,,
797,Cellular learning requires energy for adaptive modification of cellular responses.,,,
798,Cellular adaptation requires energy for adjusting function to environmental conditions.,,,
799,Synthetic biology applications require understanding of cellular energy allocation principles.,,,
800,Future cellular research will continue revealing molecular foundations of DEB principles.,,,
