Number,DEB Stylized Fact,Accuracy,I have an explanation,Importance
901,Thermoregulation consumes significant amounts of energy in endothermic organisms.,,,
902,Q$_{10}$ effects influence all metabolic rates in ectothermic species.,,,
903,Critical thermal maximum/minimum temperatures determine metabolic limits.,,,
904,Behavioral thermoregulation can save energy compared to physiological.,,,
905,Seasonal acclimation changes thermal tolerances and metabolic rates.,,,
906,Heat exchange surface area limits thermoregulatory capabilities.,,,
907,"Insulation (fur, feathers, fat) affects energetic costs of thermoregulation.",,,
908,Vascularization determines efficiency of heat transport through the body.,,,
909,Hibernation/torpor represent extreme metabolic depressions with dramatic cost reductions.,,,
910,Fever increases basal metabolism as part of immune response.,,,
911,Thermoneutral zone represents optimal temperature range for minimal energy allocation to thermoregulation.,,,
912,Brown adipose tissue provides specialized energy allocation for non-shivering thermogenesis.,,,
913,Shivering thermogenesis converts energy stored in muscles directly to heat production.,,,
914,Countercurrent heat exchange systems conserve energy by preventing heat loss.,,,
915,Thermal conductance varies with body size affecting energy allocation for temperature regulation.,,,
916,Evaporative cooling requires energy allocation for water loss and can lead to dehydration.,,,
917,Basking behavior in ectotherms reduces energy allocation needed for metabolic heat production.,,,
918,Thermal hysteresis proteins prevent freezing and reduce energy costs in cold-adapted organisms.,,,
919,Heat shock proteins require energy allocation for synthesis during thermal stress.,,,
920,Thermal tolerance windows determine geographic distribution and energy allocation strategies.,,,
921,Body size affects thermal inertia and influences energy allocation for temperature regulation.,,,
922,Metabolic heat production efficiency varies among tissues affecting thermoregulatory energy allocation.,,,
923,Thermal refugia seeking behavior involves energy costs for movement and habitat selection.,,,
924,Cold-induced thermogenesis requires immediate energy allocation from available reserves.,,,
925,Heat stress response involves energy allocation for cellular protection and repair mechanisms.,,,
926,Thermal acclimation involves long-term energy investment in physiological adjustments.,,,
927,Penguin huddling behavior reduces individual energy allocation for thermoregulation through cooperation.,,,
928,Thermal imaging reveals energy allocation patterns through heat distribution analysis.,,,
929,Circadian thermoregulation involves energy allocation that varies with daily activity patterns.,,,
930,Thermal stress affects reproductive energy allocation by increasing maintenance costs.,,,
931,Heat dissipation mechanisms require energy allocation for vasodilation and circulatory adjustments.,,,
932,Thermal buffering by environment reduces energy allocation needed for active thermoregulation.,,,
933,Age-related changes in thermoregulation affect energy allocation efficiency in older organisms.,,,
934,Sex differences in thermoregulation reflect different energy allocation strategies between males and females.,,,
935,Thermal sensitivity of enzyme systems determines temperature effects on energy allocation patterns.,,,
936,Microclimate selection allows organisms to optimize energy allocation by choosing favorable thermal conditions.,,,
937,Thermal pollution affects aquatic organism energy allocation by altering optimal temperature ranges.,,,
938,Climate change forces adaptation in thermoregulatory energy allocation strategies.,,,
939,Thermal physiology modeling predicts energy allocation under different temperature scenarios.,,,
940,Insulation quality determines energy allocation efficiency for maintaining body temperature.,,,
941,Thermal radiation exchange affects energy balance and allocation in various environments.,,,
942,Conductive heat loss varies with substrate contact affecting energy allocation in different habitats.,,,
943,Convective heat transfer depends on air movement affecting energy allocation for thermoregulation.,,,
944,Thermal mass of organisms affects rate of temperature change and energy allocation responses.,,,
945,Polar organism adaptations include specialized energy allocation for extreme cold survival.,,,
946,Desert organism adaptations optimize energy allocation for extreme heat tolerance.,,,
947,Aquatic thermoregulation involves different energy allocation strategies than terrestrial environments.,,,
948,High altitude adaptations include energy allocation adjustments for low temperature and oxygen.,,,
949,Thermal niche partitioning affects competitive energy allocation among coexisting species.,,,
950,Thermal performance curves describe energy allocation efficiency across temperature ranges.,,,
951,Biophysical modeling integrates energy allocation with heat transfer mechanisms.,,,
952,Thermal ecology applications include predicting energy allocation under climate change scenarios.,,,
953,Temperature-dependent sex determination affects energy allocation to reproductive development.,,,
954,Thermal shock recovery requires significant energy allocation for cellular repair mechanisms.,,,
955,Thermogenesis regulation involves complex energy allocation trade-offs between heat production and other functions.,,,
956,Thermal adaptation evolution shapes energy allocation strategies over geological time scales.,,,
957,Urban heat islands affect wildlife energy allocation by altering local thermal environments.,,,
958,Thermoregulatory behavior includes energy allocation for nest construction and microhabitat modification.,,,
959,Thermal stress biomarkers reflect energy allocation responses to temperature challenges.,,,
960,Global warming impacts require understanding of thermoregulatory energy allocation limits.,,,
961,Thermal physiology research advances understanding of energy allocation under temperature stress.,,,
962,Conservation applications include protecting thermal habitat quality for optimal energy allocation.,,,
963,Thermoregulatory energetics affect population dynamics through individual energy allocation patterns.,,,
964,Thermal pollution mitigation requires understanding of organism energy allocation responses.,,,
965,Captive animal management includes optimizing thermal conditions for efficient energy allocation.,,,
966,Thermal physiology education promotes understanding of energy allocation principles.,,,
967,Agricultural applications optimize thermal conditions for livestock energy allocation efficiency.,,,
968,Thermal stress testing evaluates organism energy allocation capacity under extreme conditions.,,,
969,Climate adaptation strategies must consider thermoregulatory energy allocation constraints.,,,
970,Thermal ecology monitoring tracks changes in organism energy allocation responses to warming.,,,
971,Biophysical constraints limit possible energy allocation strategies under thermal stress.,,,
972,Thermoregulatory flexibility allows adaptation of energy allocation to variable thermal conditions.,,,
973,Thermal tolerance breeding programs aim to improve energy allocation efficiency under heat stress.,,,
974,Building design applications consider occupant thermoregulatory energy allocation needs.,,,
975,Thermal physiology databases support comparative analysis of energy allocation strategies.,,,
976,Ecosystem thermal dynamics affect community energy allocation patterns and food web structure.,,,
977,Thermoregulatory evolution continues shaping energy allocation strategies in response to climate change.,,,
978,Thermal stress management requires integrated approaches considering energy allocation across biological scales.,,,
979,Future thermal physiology research will advance understanding of energy allocation under changing climates.,,,
980,"Thermal biology applications continue expanding across medicine, agriculture, conservation, and biotechnology fields.",,,
981,Thermoregulatory energy allocation represents fundamental constraint affecting all aspects of organism biology.,,,
982,Biophysical modeling approaches integrate energy allocation with environmental thermal dynamics.,,,
983,Thermal adaptation limits constrain possible evolutionary responses to energy allocation challenges.,,,
984,Thermoregulatory research contributes to understanding energy allocation principles across biological diversity.,,,
985,Climate change biology requires comprehensive understanding of thermoregulatory energy allocation responses.,,,
986,Thermal physiology education promotes appreciation for energy allocation constraints in biological systems.,,,
987,Conservation thermal biology protects species energy allocation capabilities under changing conditions.,,,
988,Thermoregulatory energy allocation research advances fundamental understanding of life under thermal stress.,,,
989,Applied thermal biology optimizes energy allocation for human benefit while protecting natural systems.,,,
990,Integrated thermoregulatory science combines energy allocation theory with empirical thermal biology research.,,,
991,Thermal stress physiology reveals fundamental limits on energy allocation under extreme conditions.,,,
992,Thermoregulatory energy allocation strategies continue evolving in response to global environmental change.,,,
993,Biophysical thermal ecology provides framework for understanding energy allocation in natural systems.,,,
994,Thermal adaptation research reveals mechanisms of energy allocation optimization under temperature stress.,,,
995,Thermoregulatory conservation requires protecting energy allocation capabilities and thermal habitat quality.,,,
996,Climate thermal biology advances prediction of energy allocation responses to future conditions.,,,
997,Thermal physiology applications benefit human welfare while advancing scientific understanding.,,,
998,Thermoregulatory energy allocation research contributes to broader understanding of biological organization.,,,
999,Future thermal biology will continue revealing energy allocation principles governing life under thermal constraints.,,,
1000,Thermoregulation and biophysical constraints represent fundamental aspects of energy allocation in all living systems.,,,
